{
  "schema": "cortex.plan/v1",
  "id": "123e4567-e89b-42d3-a456-426614174000",
  "created_at": "2026-01-02T03:04:05Z",
  "producer": {
    "agent": "builder",
    "run": "run-001"
  },
  "work_item": "spec-02b",
  "body": {
    "mode": "sequential",
    "max_agents": 1,
    "steps": [
      {
        "id": "s1",
        "title": "Step 1",
        "assignee": "builder",
        "depends_on": [],
        "acceptance": ["CA-01"]
      }
    ]
  },
  "parent_id": "123e4567-e89b-42d3-a456-426614174000"
}
